{
  "schema_version": "0.1",
  "slide_id": "OUT-S001",
  "source_slide_id": "SRC-S011",
  "adaptation_mode": "ADAPT",
  "composer_support": "supported",
  "content_units": [
    "CU-004"
  ],
  "content_blocks": [
    {
      "id": "CB-01",
      "role": "title",
      "source_text": "会社概要",
      "semantic_text": "主要機能の比較",
      "render_text": "主要機能の比較",
      "priority": 1
    },
    {
      "id": "CB-02",
      "role": "subtitle",
      "source_text": "会社の主要な情報を紹介するのに適したページです。",
      "semantic_text": "Googleフォーム / Lite / フル版",
      "render_text": "Googleフォーム / Lite / フル版",
      "priority": 2
    }
  ],
  "source_object_mutations": [
    {
      "source_object_id": "SRC-S011-O005",
      "action": "replace_text",
      "content_block_id": "CB-01",
      "render_text": "主要機能の比較",
      "reason": "page title"
    },
    {
      "source_object_id": "SRC-S011-O006",
      "action": "replace_text",
      "content_block_id": "CB-02",
      "render_text": "Googleフォーム / Lite / フル版",
      "reason": "scope"
    },
    {
      "source_object_id": "SRC-S011-O010",
      "action": "replace_table",
      "table_data": [
        [
          "機能",
          "Googleフォーム",
          "Lite",
          "フル版"
        ],
        [
          "フォーム項目",
          "○",
          "○",
          "○"
        ],
        [
          "レシート応募",
          "△※",
          "○",
          "○"
        ],
        [
          "デザイン変更",
          "×",
          "○",
          "○"
        ],
        [
          "応募検索",
          "△",
          "○",
          "○"
        ],
        [
          "データ出力",
          "○",
          "○",
          "○"
        ],
        [
          "抽選",
          "△",
          "○",
          "○"
        ],
        [
          "OCR",
          "×",
          "×",
          "○"
        ],
        [
          "カスタマイズ性",
          "×",
          "×",
          "○"
        ]
      ],
      "column_width_weights": [
        2.4,
        1.3,
        1.0,
        1.0
      ],
      "header_rows": 1,
      "replace_region_object_ids": [
        "SRC-S011-O004",
        "SRC-S011-O010",
        "SRC-S011-O011",
        "SRC-S011-O012",
        "SRC-S011-O013",
        "SRC-S011-O014"
      ],
      "reason": "replace company content region with editable comparison table"
    }
  ],
  "status": "APPROVED"
}